{
  "schema_version": "task-session.material-producer-receipt.v1",
  "receipt_id": "swu-tsgr-005-staged-material-20260730T211000Z",
  "runtime": "codex",
  "adapter": "native-background-helper",
  "source_swu": "SWU-TSGR-005",
  "swu_id": "SWU-TSGR-005",
  "result": "pass",
  "authority_ceiling": "isolated-staged-material-only",
  "files_touched": [
    "arcanum/arcana/task-session/scripts/task-session-governance-runner.py",
    "arcanum/arcana/task-session/development/fixtures/governance-runner-cases.json",
    "arcanum/arcana/task-session/development/validate-governance-runner.py"
  ],
  "source_artifacts": [
    {
      "role": "sigil-development-contract",
      "artifact_ref": {
        "path": ".agents/skills/sigil-development/SKILL.md",
        "sha256": "fcfa1f889fac49d0c2419970588f35ab3597e6234498cb15bbeb62c37bd77161",
        "size_bytes": 12121
      }
    },
    {
      "role": "work-pack-selection",
      "artifact_ref": {
        "path": "arcanum/arcana/task-session/development/invoke-runs/20260730T170810Z-deterministic-governance-runner/WORK-PACK.md",
        "sha256": "7aca9622522712a942af7cfae576a7480b3dd5ee25a431806c20f5533bb42a1f",
        "size_bytes": 9459
      }
    },
    {
      "role": "swu-contract",
      "artifact_ref": {
        "path": "arcanum/arcana/task-session/development/invoke-runs/20260730T170810Z-deterministic-governance-runner/work-pack/tasks/TASK-TSGR-02-RUNNER.md",
        "sha256": "f6e95c0ba2bfee4f0dac25fb2e69f2e837d698721ea0e86a6a0c39e30ee29eef",
        "size_bytes": 3444
      }
    },
    {
      "role": "predecessor-terminal-result",
      "artifact_ref": {
        "path": "arcanum/arcana/task-session/development/invoke-runs/20260730T170810Z-deterministic-governance-runner/work-pack/results/SWU-TSGR-004-RESULT.json",
        "sha256": "b85ae6c05af69b17929685abd86b814751f120c3916b07e9aaa8c04c24231cdf",
        "size_bytes": 2922
      }
    },
    {
      "role": "predecessor-closeout-join",
      "artifact_ref": {
        "path": "arcanum/arcana/task-session/development/invoke-runs/20260730T170810Z-deterministic-governance-runner/work-pack/closeout/SWU-TSGR-004-CONTINUATION-OWNER-RECEIPT.json",
        "sha256": "d8e23f2e4378b73e4593c5ef2a14fb7b1b4597dad4c495c50f28d2c30e8e55cc",
        "size_bytes": 1209
      }
    },
    {
      "role": "closeout-preflight",
      "artifact_ref": {
        "path": "arcanum/arcana/task-session/development/invoke-runs/20260730T170810Z-deterministic-governance-runner/refreshes/20260730T211000Z-swu-tsgr-005-producer/task-session-review/CLOSEOUT-PREFLIGHT.json",
        "sha256": "305271ff8126568af2c488dd068f1c14b955805ccf6d8243e7d7320f573b3346",
        "size_bytes": 3798
      }
    },
    {
      "role": "strict-context-pack",
      "artifact_ref": {
        "path": "arcanum/arcana/task-session/development/invoke-runs/20260730T170810Z-deterministic-governance-runner/refreshes/20260730T211000Z-swu-tsgr-005-producer/task-session-apply/CONTEXT-PACK.json",
        "sha256": "716b35d129ff618d6a132438e8b41ecf1167520294762cb142a63103a42156b6",
        "size_bytes": 4178
      }
    }
  ],
  "staged_root": "arcanum/arcana/task-session/development/invoke-runs/20260730T170810Z-deterministic-governance-runner/refreshes/20260730T211000Z-swu-tsgr-005-producer/producer/staged",
  "manifest_ref": {
    "path": "arcanum/arcana/task-session/development/invoke-runs/20260730T170810Z-deterministic-governance-runner/refreshes/20260730T211000Z-swu-tsgr-005-producer/producer/staged-manifest.json",
    "sha256": "f5e7c2f927e4ad9c21c672204be4bc048bdc06798e3aea24d87840122bde6fdb",
    "size_bytes": 2633
  },
  "staged_manifest_sha256": "661a8ff37cf6d5adae8e37a933b8865ff1d1e60058baa699547ea308de3e58bf",
  "staged_outputs": [
    {
      "target_path": "arcanum/arcana/task-session/scripts/task-session-governance-runner.py",
      "output_ref": {
        "path": "arcanum/arcana/task-session/development/invoke-runs/20260730T170810Z-deterministic-governance-runner/refreshes/20260730T211000Z-swu-tsgr-005-producer/producer/staged/arcanum/arcana/task-session/scripts/task-session-governance-runner.py",
        "sha256": "d64b2f81b0921eb0a7348c8f23f95ca7eac47228f573ff2251ea36e008ad4d23",
        "size_bytes": 41572
      }
    },
    {
      "target_path": "arcanum/arcana/task-session/development/fixtures/governance-runner-cases.json",
      "output_ref": {
        "path": "arcanum/arcana/task-session/development/invoke-runs/20260730T170810Z-deterministic-governance-runner/refreshes/20260730T211000Z-swu-tsgr-005-producer/producer/staged/arcanum/arcana/task-session/development/fixtures/governance-runner-cases.json",
        "sha256": "fd311527f869432283af6654b3be2159563252e0b9ecc9923578484c4b545471",
        "size_bytes": 6489
      }
    },
    {
      "target_path": "arcanum/arcana/task-session/development/validate-governance-runner.py",
      "output_ref": {
        "path": "arcanum/arcana/task-session/development/invoke-runs/20260730T170810Z-deterministic-governance-runner/refreshes/20260730T211000Z-swu-tsgr-005-producer/producer/staged/arcanum/arcana/task-session/development/validate-governance-runner.py",
        "sha256": "52456a262faeb43646b7c4cf6e93aa476c7232cc62536b0ea76c147f3d16e83d",
        "size_bytes": 49904
      }
    }
  ],
  "canonical_target_preconditions": [
    {
      "target_path": "arcanum/arcana/task-session/scripts/task-session-governance-runner.py",
      "state": "present",
      "live_ref": {
        "path": "arcanum/arcana/task-session/scripts/task-session-governance-runner.py",
        "sha256": "422039c4388e28d18b8baeb73f8f9834ec85adaea7e9237847136a731fc0ce74",
        "size_bytes": 30472
      }
    },
    {
      "target_path": "arcanum/arcana/task-session/development/fixtures/governance-runner-cases.json",
      "state": "present",
      "live_ref": {
        "path": "arcanum/arcana/task-session/development/fixtures/governance-runner-cases.json",
        "sha256": "0bab93d36d55697cc39ba3d1753967030f6398d56a092d86157cb8943a306b43",
        "size_bytes": 4151
      }
    },
    {
      "target_path": "arcanum/arcana/task-session/development/validate-governance-runner.py",
      "state": "present",
      "live_ref": {
        "path": "arcanum/arcana/task-session/development/validate-governance-runner.py",
        "sha256": "40a359d9e69245a336623d2d99d2504aaeec978632ae4a4afdeca9c8aa716249",
        "size_bytes": 28977
      }
    }
  ],
  "target_root_convention": {
    "root": ".",
    "path_form": "repository-relative",
    "staged_prefix": "producer/staged"
  },
  "owner_matrix": {
    "selection_owner": "task-session",
    "material_owner": "sigil-development",
    "execution_owner": "task-session",
    "closeout_owner": "invoke-via-continuation-router",
    "experiment_owner": "SWU-TSGR-010"
  },
  "validations": [
    {
      "argv": [
        "python3",
        "arcana/task-session/development/validate-governance-runner.py",
        "--family",
        "reconcile"
      ],
      "cwd": "arcanum/arcana/task-session/development/invoke-runs/20260730T170810Z-deterministic-governance-runner/refreshes/20260730T211000Z-swu-tsgr-005-producer/producer/staged/arcanum",
      "exit_code": 0,
      "result": "pass",
      "case_counts": {
        "positive": "10/10",
        "negative": "20/20",
        "undeclared_outputs": 0
      },
      "evidence": [
        "apply and already-present-exact-output classifications passed without target writes",
        "missing, undeclared, conflict, critical-validation, re-admission, cardinality, and evidence-drift cases blocked"
      ]
    },
    {
      "argv": [
        "python3",
        "arcana/task-session/development/validate-governance-runner.py",
        "--family",
        "reconcile",
        "--material-inventory-manifest",
        "../../staged-manifest.json"
      ],
      "cwd": "arcanum/arcana/task-session/development/invoke-runs/20260730T170810Z-deterministic-governance-runner/refreshes/20260730T211000Z-swu-tsgr-005-producer/producer/staged/arcanum",
      "exit_code": 0,
      "result": "pass",
      "case_counts": {
        "positive": "10/10",
        "negative": "20/20",
        "undeclared_outputs": 0
      },
      "evidence": [
        "producer manifest target inventory exactly matched the three owned outputs"
      ]
    },
    {
      "argv": [
        "python3",
        "arcana/task-session/development/validate-governance-runner.py",
        "--family",
        "prepare"
      ],
      "cwd": "arcanum/arcana/task-session/development/invoke-runs/20260730T170810Z-deterministic-governance-runner/refreshes/20260730T211000Z-swu-tsgr-005-producer/producer/staged/arcanum",
      "exit_code": 0,
      "result": "pass",
      "case_counts": {
        "positive": "3/3",
        "negative": "6/6",
        "undeclared_outputs": 0
      },
      "evidence": [
        "prepare replay remained byte-stable and status remained read-only"
      ]
    },
    {
      "argv": [
        "python3",
        "arcana/task-session/development/validate-governance-runner.py",
        "--family",
        "executor-join"
      ],
      "cwd": "arcanum/arcana/task-session/development/invoke-runs/20260730T170810Z-deterministic-governance-runner/refreshes/20260730T211000Z-swu-tsgr-005-producer/producer/staged/arcanum",
      "exit_code": 0,
      "result": "pass",
      "case_counts": {
        "positive": "6/6",
        "negative": "13/13",
        "undeclared_outputs": 0
      },
      "evidence": [
        "structured executor launch-or-join regression remained passing"
      ]
    },
    {
      "argv": [
        "git",
        "diff",
        "--check",
        "--",
        "arcanum/arcana/task-session/development/invoke-runs/20260730T170810Z-deterministic-governance-runner/refreshes/20260730T211000Z-swu-tsgr-005-producer/producer"
      ],
      "cwd": ".",
      "exit_code": 0,
      "result": "pass",
      "case_counts": {
        "positive": "n/a",
        "negative": "n/a",